{
  "$schema": "https://json-schema.org/draft/2020-12/schema",
  "$id": "https://orvyq.dev/schemas/frozen_candidate.schema.json",
  "title": "Frozen Candidate",
  "description": "Per the task's canonical freeze model (section 10): a snapshot of exactly what would render, identified by hashes of every canonical input. Proof approval references a frozen_candidate by hash; full render is only permitted from the exact approved frozen_candidate -- any changed hash invalidates the approval.",
  "type": "object",
  "required": [
    "project_id", "source_commit_sha", "renderer_version", "timeline_hash", "edit_plan_hash",
    "caption_hash", "audio_mix_hash", "asset_registry_hash", "selected_render_range", "mode", "created_at"
  ],
  "properties": {
    "project_id": { "type": "string" },
    "source_commit_sha": { "type": "string", "pattern": "^[0-9a-f]{40}$" },
    "renderer_version": { "type": "string" },
    "timeline_hash": { "type": "string", "pattern": "^[0-9a-f]{64}$" },
    "edit_plan_hash": { "type": "string", "pattern": "^[0-9a-f]{64}$" },
    "caption_hash": { "type": "string", "pattern": "^[0-9a-f]{64}$" },
    "audio_mix_hash": { "type": "string", "pattern": "^[0-9a-f]{64}$" },
    "asset_registry_hash": { "type": "string", "pattern": "^[0-9a-f]{64}$" },
    "approval_version": {
      "type": "string",
      "description": "Marks which verification scheme (scripts/orvyq_verify_approval.mjs) this candidate expects to be checked under. Optional and absent on frozen candidates produced before hash-hardened approval verification existed -- their approval remains valid under the original approved===true + frozen_candidate_hash check they were reviewed against."
    },
    "renderer_commit_sha": {
      "type": "string",
      "pattern": "^[0-9a-f]{40}$",
      "description": "git SHA of the last commit that touched templates/remotion, independent of source_commit_sha (the checkout commit) -- lets renderer drift be detected even when other project data changes without a renderer change."
    },
    "narration_sha256": {
      "type": "string",
      "pattern": "^[0-9a-f]{64}$",
      "description": "sha256 of the exact narration audio this candidate's edit plan was timed against (voice/narration_status.json's narration_sha256 for full mode)."
    },
    "pause_map_hash": {
      "type": "string",
      "pattern": "^[0-9a-f]{64}$",
      "description": "sha256 of direction/editorial_pause_map.json's real file content."
    },
    "script_hash": {
      "type": "string",
      "pattern": "^[0-9a-f]{64}$",
      "description": "sha256 of voice/voice_script.txt's real file content."
    },
    "selected_render_range": {
      "type": "object",
      "required": ["start_frame", "end_frame"],
      "properties": {
        "start_frame": { "type": "integer", "minimum": 0 },
        "end_frame": { "type": "integer", "minimum": 1 }
      },
      "additionalProperties": false
    },
    "mode": { "enum": ["proof", "full"] },
    "created_at": { "type": "string", "format": "date-time" }
  },
  "additionalProperties": false
}
