{
  "project_id": "001-the-ai-race-no-one-can-afford-to-win",
  "source_commit_sha": "46afc6b4c2cb35b6594fcfeadb9ee64a6c59c2d1",
  "renderer_version": "templates/remotion@1.0.0",
  "timeline_hash": "63ef8be33fc9bbb76e622f8f0dfffcebd6d3a17f5737bd372d4d318c69931695",
  "edit_plan_hash": "b459fbcabdb3ac47f8bfcc7d1e091970164d626be102707b0d6f9951628e4bbd",
  "caption_hash": "521b525a9d39ce7e0410079a3444eb432370aae11df97c08238d24978624f86f",
  "audio_mix_hash": "0eaecf2d9ac41101668c590db6b16165f642f42df816f5c38952cc2063b2fbf0",
  "asset_registry_hash": "b707bb02fe6ac0a5844e2855056a5818acfa79aba8083cb6cca9c4df27243e6e",
  "approval_version": "2.0-hash-hardened",
  "renderer_commit_sha": "46afc6b4c2cb35b6594fcfeadb9ee64a6c59c2d1",
  "narration_sha256": "94072f306e79b98fb1a2049daaddb255f6d8e2c67f474742b4ccb797df985dd",
  "pause_map_hash": "297e16717a3916b5e5d87921848b569f5e4c287831c7407cb64f25ecc30fa687",
  "script_hash": "d06c6c923d3026171557ee924c5d74c6cc34bb8d3236fb7cb45f2ccacba66bfc",
  "selected_render_range": {
    "start_frame": 0,
    "end_frame": 7127
  },
  "mode": "proof",
  "created_at": "2026-07-23T11:44:29.474Z"
}
